``fit_quality``	int	Fit quality parameter (3 - Full accurate covariance matrix, 2 - Full matrix, but forced positive-definite (i.e. not accurate), 1 - Diagonal approximation only, not accurate, 0 - Error matrix not calculated at all)
``errors``	`~numpy.ndarray`	Vector of parameter errors (unscaled).
``loglike``	float	Post-fit log-likehood value.
``correlation``	`~numpy.ndarray`	Correlation matrix between free parameters of the fit.
``values``	`~numpy.ndarray`	Vector of best-fit parameter values (unscaled).
``config``	dict	Copy of input configuration to this method.
``covariance``	`~numpy.ndarray`	Covariance matrix between free parameters of the fit.
``dloglike``	float	Improvement in log-likehood value.
